chapter,sense,lemma,sentence,sentence_start_char,sentence_end_char
34,TASTE,delicacy,"You will see what impetus would be given to your efforts and mine by our physical and mental union in marriage: the only union that gives a character of permanent conformity to the destinies and designs of human beings; and, passing over all minor caprices—all trivial difficulties and delicacies of feeling—all scruple about the degree, kind, strength or tenderness of mere personal inclination—you will hasten to enter into that union at once.”",43698,44146
34,TASTE,consume,"There would be recesses in my mind which would be only mine, to which he never came, and sentiments growing there fresh and sheltered which his austerity could never blight, nor his measured warrior-march trample down: but as his wife—at his side always, and always restrained, and always checked—forced to keep the fire of my nature continually low, to compel it to burn inwardly and never utter a cry, though the imprisoned flame consumed vital after vital—_this_ would be unendurable.",45165,45654
36,TASTE,delicacy,"They might have said, as I have no doubt they thought, that they had believed me to be without any friends save them: for, indeed, I had often said so; but, with their true natural delicacy, they abstained from comment, except that Diana asked me if I was sure I was well enough to travel.",3086,3375
37,TASTE,sweetness,"No—I have touched you, heard you, felt the comfort of your presence—the sweetness of your consolation: I cannot give up these joys.",12668,12799
37,TASTE,taste,"“His manners, I think, you said are not to your taste?—priggish and parsonic?” “I never mentioned his manners; but, unless I had a very bad taste, they must suit it; they are polished, calm, and gentlemanlike.”",25332,25545
37,TASTE,taste,"I asked of God, at once in anguish and humility, if I had not been long enough desolate, afflicted, tormented; and might not soon taste bliss and peace once more.",36936,37098
