chapter,sense,lemma,sentence,sentence_start_char,sentence_end_char
28,TOUCH,hold,Not a tie holds me to human society at this moment—not a charm or hope calls me where my fellow-creatures are—none that saw me would have a kind thought or a good wish for me.,1571,1746
28,TOUCH,hold,"I struck straight into the heath; I held on to a hollow I saw deeply furrowing the brown moorside; I waded knee-deep in its dark growth; I turned with its turnings, and finding a moss-blackened granite crag in a hidden angle, I sat down under it.",1840,2086
28,TOUCH,feel,"Some time passed before I felt tranquil even here: I had a vague dread that wild cattle might be near, or that some sportsman or poacher might discover me.",2173,2328
28,TOUCH,tremble,"Oh, intolerable questions, when I could do nothing and go nowhere!—when a long way must yet be measured by my weary, trembling limbs before I could reach human habitation—when cold charity must be entreated before I could get a lodging: reluctant sympathy importuned, almost certain repulse incurred, before my tale could be listened to, or one of my wants relieved!",2736,3104
28,TOUCH,cold,"Oh, intolerable questions, when I could do nothing and go nowhere!—when a long way must yet be measured by my weary, trembling limbs before I could reach human habitation—when cold charity must be entreated before I could get a lodging: reluctant sympathy importuned, almost certain repulse incurred, before my tale could be listened to, or one of my wants relieved!",2736,3104
28,TOUCH,touch,"I touched the heath: it was dry, and yet warm with the heat of the summer day.",3104,3182
28,TOUCH,softness,"The dew fell, but with propitious softness; no breeze whispered.",3268,3332
28,TOUCH,cold,"Thus lodged, I was not, at least at the commencement of the night, cold.",4343,4417
28,TOUCH,tremble,"It trembled for Mr. Rochester and his doom; it bemoaned him with bitter pity; it demanded him with ceaseless longing; and, impotent as a bird with both wings broken, it still quivered its shattered pinions in vain attempts to seek him.",4557,4794
28,TOUCH,feel,"We know that God is everywhere; but certainly we feel His presence most when His works are on the grandest scale spread before us; and it is in the unclouded night-sky, where His worlds wheel their silent course, that we read clearest His infinitude, His omnipotence, His omnipresence.",4960,5245
28,TOUCH,feel,Remembering what it was—what countless systems there swept space like a soft trace of light—I felt the might and strength of God.,5361,5491
28,TOUCH,feel,I felt it would be degrading to faint with hunger on the causeway of a hamlet.,8675,8753
28,TOUCH,feel,"I dared not offer her the half-worn gloves, the creased handkerchief: besides, I felt it would be absurd.",9335,9440
28,TOUCH,touch,What business had I to approach the white door or touch the glittering knocker?,11402,11481
28,TOUCH,hold,"If she had held it open a little longer, I believe I should have begged a piece of bread; for I was now brought low.",12328,12446
28,TOUCH,feel,"I felt it was what was to be expected, and what could not be helped: an ordinary beggar is frequently an object of suspicion; a well-dressed beggar inevitably so.",15459,15621
28,TOUCH,cold,"But my night was wretched, my rest broken: the ground was damp, the air cold: besides, intruders passed near me more than once, and I had again and again to change my quarters: no sense of safety or tranquillity befriended me.",16663,16889
28,TOUCH,cold,At the door of a cottage I saw a little girl about to throw a mess of cold porridge into a pig trough.,17125,17227
28,TOUCH,feel,“I feel I cannot go much farther.,17744,17777
28,TOUCH,cold,"While the rain descends so, must I lay my head on the cold, drenched ground?",17818,17895
28,TOUCH,chill,"But it will be very dreadful, with this feeling of hunger, faintness, chill, and this sense of desolation—this total prostration of hope.",17950,18087
28,TOUCH,cold,"Because I know, or believe, Mr. Rochester is living: and then, to die of want and cold is a fate to which nature cannot submit passively.",18250,18387
28,TOUCH,feel,"It remained now only to find a hollow where I could lie down, and feel at least hidden, if not secure.",19195,19297
28,TOUCH,feel,Could I but have stiffened to the still frost—the friendly numbness of death—it might have pelted on; I should not have felt it; but my yet living flesh shuddered at its chilling influence.,20566,20755
28,TOUCH,feel,"I put out my hand to feel the dark mass before me: I discriminated the rough stones of a low wall—above it, something like palisades, and within, a high and prickly hedge.",21581,21752
28,TOUCH,touch,Again a whitish object gleamed before me: it was a gate—a wicket; it moved on its hinges as I touched it.,21766,21871
28,TOUCH,warmth,"A group of more interest appeared near the hearth, sitting still amidst the rosy peace and warmth suffusing it.",23165,23276
28,TOUCH,hold,"A stand between them supported a second candle and two great volumes, to which they frequently referred, comparing them, seemingly, with the smaller books they held in their hands, like people consulting a dictionary to aid them in the task of translation.",24094,24350
28,TOUCH,grate,"This scene was as silent as if all the figures had been shadows and the firelit apartment a picture: so hushed was it, I could hear the cinders fall from the grate, the clock tick in its obscure corner; and I even fancied I could distinguish the click-click of the woman’s knitting-needles.",24351,24641
28,TOUCH,stroke,"At a later day, I knew the language and the book; therefore, I will here quote the line: though, when I first heard it, it was only like a stroke on sounding brass to me—conveying no meaning:— “‘Da trat hervor Einer, anzusehen wie die Sternen Nacht.’",25309,25560
28,TOUCH,touch,And how impossible did it appear to touch the inmates of this house with concern on my behalf; to make them believe in the truth of my wants and woes—to induce them to vouchsafe a rest for my wanderings!,29300,29503
28,TOUCH,feel,"As I groped out the door, and knocked at it hesitatingly, I felt that last idea to be a mere chimera.",29504,29605
28,TOUCH,hold,"she inquired, in a voice of surprise, as she surveyed me by the light of the candle she held.",29642,29737
28,TOUCH,cold,"“Well, how wet and cold you must be, such a wild night as it is!",32485,32549
28,TOUCH,tremble,"Presently I stood within that clean, bright kitchen—on the very hearth—trembling, sickening; conscious of an aspect in the last degree ghastly, wild, and weather-beaten.",33128,33297
28,TOUCH,feel,"Her face was near mine: I saw there was pity in it, and I felt sympathy in her hurried breathing.",34145,34242
28,TOUCH,feel,"I felt I could speak, and I answered—“My name is Jane Elliott.”",34744,34807
28,TOUCH,feel,"Somehow, now that I had once crossed the threshold of this house, and once was brought face to face with its owners, I felt no longer outcast, vagrant, and disowned by the wide world.",35051,35234
28,TOUCH,feel,Do with me and for me as you like; but excuse me from much discourse—my breath is short—I feel a spasm when I speak.”,36125,36242
29,TOUCH,sensation,"I can recall some sensations felt in that interval; but few thoughts framed, and no actions performed.",88,190
29,TOUCH,feel,"I can recall some sensations felt in that interval; but few thoughts framed, and no actions performed.",88,190
29,TOUCH,feel,"When she left me, I felt comparatively strong and revived: ere long satiety of repose and desire for action stirred me.",3503,3622
29,TOUCH,feel,I felt ashamed to appear before my benefactors so clad.,3760,3815
29,TOUCH,brush,"There were the means of washing in the room, and a comb and brush to smooth my hair.",4130,4214
29,TOUCH,warmth,It was full of the fragrance of new bread and the warmth of a generous fire.,4670,4746
29,TOUCH,cold,"Hannah had been cold and stiff, indeed, at the first: latterly she had begun to relent a little; and when she saw me come in tidy and well-dressed, she even smiled.",4951,5117
29,TOUCH,firmness,"Turning to me, as she took some loaves from the oven, she asked bluntly— “Did you ever go a-begging afore you came here?” I was indignant for a moment; but remembering that anger was out of the question, and that I had indeed appeared as a beggar to her, I answered quietly, but still not without a certain marked firmness— “You are mistaken in supposing me a beggar.",5367,5737
29,TOUCH,stroke,“And his sisters are called Diana and Mary Rivers?” “Yes.” “Their father is dead?” “Dead three weeks sin’ of a stroke.”,7607,7731
29,TOUCH,feel,"Mr. St. John, when he saw me, merely bowed and passed through; the two ladies stopped: Mary, in a few words, kindly and calmly expressed the pleasure she felt in seeing me well enough to be able to come down; Diana took my hand: she shook her head at me.",11720,11976
29,TOUCH,feel,"It was my nature to feel pleasure in yielding to an authority supported like hers, and to bend, where my conscience and self-respect permitted, to an active will.",12494,12658
29,TOUCH,hold,"And still holding my hand she made me rise, and led me into the inner room.",13094,13171
29,TOUCH,feel,"The three looked at me, but not distrustfully; I felt there was no suspicion in their glances: there was more of curiosity.",16803,16926
29,TOUCH,feel,No.” I felt a burning glow mount to my face; for bitter and agitating recollections were awakened by the allusion to marriage.,17890,18017
29,TOUCH,cold,"Diana and Mary relieved me by turning their eyes elsewhere than to my crimsoned visage; but the colder and sterner brother continued to gaze, till the trouble he had excited forced out tears as well as colour.",18066,18277
29,TOUCH,feel,"I_ feel more inclination to put you in the way of keeping yourself, and shall endeavour to do so; but observe, my sphere is narrow.",23663,23794
30,TOUCH,feel,"I felt the consecration of its loneliness: my eye feasted on the outline of swell and sweep—on the wild colouring communicated to ridge and dell by moss, by heath-bell, by flower-sprinkled turf, by brilliant bracken, and mellow granite crag.",1547,1788
30,TOUCH,touch,"I could talk a while when the evening commenced, but the first gush of vivacity and fluency gone, I was fain to sit on a stool at Diana’s feet, to rest my head on her knee, and listen alternately to her and Mary, while they sounded thoroughly the topic on which I had but touched.",2821,3101
30,TOUCH,feel,"It began calm—and indeed, as far as delivery and pitch of voice went, it was calm to the end: an earnestly felt, yet strictly restrained zeal breathed soon in the distinct accents, and prompted the nervous language.",6318,6533
30,TOUCH,feel,"When he had done, instead of feeling better, calmer, more enlightened by his discourse, I experienced an inexpressible sadness; for it seemed to me—I know not whether equally so to others—that the eloquence to which I had been listening had sprung from a depth where lay turbid dregs of disappointment—where moved troubling impulses of insatiate yearnings and disquieting aspirations.",6941,7325
30,TOUCH,hold,"Diana and Mary were soon to leave Moor House, and return to the far different life and scene which awaited them, as governesses in a large, fashionable, south-of-England city, where each held a situation in families by whose wealthy and haughty members they were regarded only as humble dependents, and who neither knew nor sought out their innate excellences, and appreciated only their acquired accomplishments as they appreciated the skill of their cook or the taste of their waiting-woman.",7726,8219
30,TOUCH,hold,I hold that the more arid and unreclaimed the soil where the Christian labourer’s task of tillage is appointed him—the scantier the meed his toil brings—the higher the honour.,11793,11968
30,TOUCH,hold,"“I believe you will accept the post I offer you,” said he, “and hold it for a while: not permanently, though: any more than I could permanently keep the narrow and narrowing—the tranquil, hidden office of English country incumbent; for in your nature is an alloy as detrimental to repose as that in mine, though of a different kind.” “Do explain,” I urged, when he halted once more.",12418,12803
30,TOUCH,hold,"I mean, that human affections and sympathies have a most powerful hold on you.",16072,16150
31,TOUCH,feel,"Not to deceive myself, I must reply—No: I felt desolate to a degree.",1815,1883
31,TOUCH,feel,"I felt—yes, idiot that I am—I felt degraded.",1884,1928
31,TOUCH,feel,"I felt—yes, idiot that I am—I felt degraded.",1884,1928
31,TOUCH,feel,"He was fond and proud of me—it is what no man besides will ever be.—But where am I wandering, and what am I saying, and above all, feeling?",3210,3349
31,TOUCH,feel,"Yes; I feel now that I was right when I adhered to principle and law, and scorned and crushed the insane promptings of a frenzied moment.",3644,3781
31,TOUCH,feel,“But you feel solitude an oppression?,6399,6436
31,TOUCH,feel,"“Very well; I hope you feel the content you express: at any rate, your good sense will tell you that it is too soon yet to yield to the vacillating fears of Lot’s wife.",6609,6777
31,TOUCH,caress,"There appeared, within three feet of him, a form clad in pure white—a youthful, graceful form: full, yet fine in contour; and when, after bending to caress Carlo, it lifted up its head, and threw back a long veil, there bloomed under his glance a face of perfect beauty.",10415,10685
31,TOUCH,caress,"As he stood, mute and grave, she again fell to caressing Carlo.",14282,14345
31,TOUCH,pat,"As she patted the dog’s head, bending with native grace before his young and austere master, I saw a glow rise to that master’s face.",14475,14608
31,TOUCH,hold,She held out her hand.,16301,16323
31,TOUCH,touch,He just touched it.,16324,16343
32,TOUCH,feel,I felt I became a favourite in the neighbourhood.,2082,2131
32,TOUCH,touch,"At this period of my life, my heart far oftener swelled with thankfulness than sank with dejection: and yet, reader, to tell you all, in the midst of this calm, this useful existence—after a day passed in honourable exertion amongst my scholars, an evening spent in drawing or reading contentedly alone—I used to rush into strange dreams at night: dreams many-coloured, agitated, full of the ideal, the stirring, the stormy—dreams where, amidst unusual scenes, charged with adventure, with agitating risk and romantic chance, I still again and again met Mr. Rochester, always at some exciting crisis; and then the sense of being in his arms, hearing his voice, meeting his eye, touching his hand and cheek, loving him, being loved by him—the hope of passing a lifetime at his side, would be renewed, with all its first force and fire.",2411,3245
32,TOUCH,tremble,"In spite of his Christian stoicism, when she went up and addressed him, and smiled gaily, encouragingly, even fondly in his face, his hand would tremble and his eye burn.",4822,4992
32,TOUCH,feel,"I drew better than her master in the first school in S——. Would I sketch a portrait of her, to show to papa?” “With pleasure,” I replied; and I felt a thrill of artist-delight at the idea of copying from so perfect and radiant a model.",8252,8488
32,TOUCH,grate,"All about me was spotless and bright—scoured floor, polished grate, and well-rubbed chairs.",10912,11003
32,TOUCH,rub,"All about me was spotless and bright—scoured floor, polished grate, and well-rubbed chairs.",10912,11003
32,TOUCH,touch,"The head was finished already: there was but the background to tint and the drapery to shade off; a touch of carmine, too, to add to the ripe lips—a soft curl here and there to the tresses—a deeper tinge to the shadow of the lash under the azured eyelid.",11286,11540
32,TOUCH,tap,"I was absorbed in the execution of these nice details, when, after one rapid tap, my door unclosed, admitting St. John Rivers.",11541,11669
32,TOUCH,feel,"No, that is well: while you draw you will not feel lonely.",11758,11816
32,TOUCH,feel,"I knew his thoughts well, and could read his heart plainly; at the moment I felt calmer and cooler than he: I had then temporarily the advantage of him, and I conceived an inclination to do him some good, if I could.",13022,13240
32,TOUCH,firmness,"“With all his firmness and self-control,” thought I, “he tasks himself too far: locks every feeling and pang within—expresses, confesses, imparts nothing.",13240,13394
32,TOUCH,hold,"He continued to gaze at the picture: the longer he looked, the firmer he held it, the more he seemed to covet it.",15006,15119
32,TOUCH,handle,I saw even that to be thus frankly addressed on a subject he had deemed unapproachable—to hear it thus freely handled—was beginning to be felt by him as a new pleasure—an unhoped-for relief.,16533,16723
32,TOUCH,feel,I saw even that to be thus frankly addressed on a subject he had deemed unapproachable—to hear it thus freely handled—was beginning to be felt by him as a new pleasure—an unhoped-for relief.,16533,16723
32,TOUCH,touch,She talks of you continually: there is no subject she enjoys so much or touches upon so often.”,17333,17430
32,TOUCH,tremble,"Only this morning, I received intelligence that the successor, whose arrival I have been so long expecting, cannot be ready to replace me for three months to come yet; and perhaps the three months may extend to six.” “You tremble and become flushed whenever Miss Oliver enters the schoolroom.”",21157,21453
32,TOUCH,feel,"For me, I felt at home in this sort of discourse.",21568,21617
32,TOUCH,cold,Know me to be what I am—a cold hard man.” I smiled incredulously.,22458,22526
32,TOUCH,cold,"I am simply, in my original state—stripped of that blood-bleached robe with which Christianity covers human deformity—a cold, hard, ambitious man.",22618,22764
32,TOUCH,feel,"Reason, and not feeling, is my guide; my ambition is unlimited: my desire to rise higher, to do more than others, insatiable.",22841,22966
33,TOUCH,touch,"I recalled his singular conduct of yesterday, and really I began to fear his wits were touched.",2020,2115
33,TOUCH,grate,"He still slowly moved his finger over his upper lip, and still his eye dwelt dreamily on the glowing grate; thinking it urgent to say something, I asked him presently if he felt any cold draught from the door, which was behind him.",3194,3427
33,TOUCH,feel,"He still slowly moved his finger over his upper lip, and still his eye dwelt dreamily on the glowing grate; thinking it urgent to say something, I asked him presently if he felt any cold draught from the door, which was behind him.",3194,3427
33,TOUCH,cold,"He still slowly moved his finger over his upper lip, and still his eye dwelt dreamily on the glowing grate; thinking it urgent to say something, I asked him presently if he felt any cold draught from the door, which was behind him.",3194,3427
33,TOUCH,stroke,“Yes.” Again came the blank of a pause: the clock struck eight strokes.,4850,4922
33,TOUCH,cold,"They left a daughter, which, at its very birth, Charity received in her lap—cold as that of the snow-drift I almost stuck fast in to-night.",6104,6243
33,TOUCH,feel,"Who has his letters?” “Mr. Briggs intimates that the answer to his application was not from Mr. Rochester, but from a lady: it is signed ‘Alice Fairfax.’” I felt cold and dismayed: my worst fears then were probably true: he had in all probability left England and rushed in reckless desperation to some former haunt on the Continent.",8802,9137
33,TOUCH,cold,"Who has his letters?” “Mr. Briggs intimates that the answer to his application was not from Mr. Rochester, but from a lady: it is signed ‘Alice Fairfax.’” I felt cold and dismayed: my worst fears then were probably true: he had in all probability left England and rushed in reckless desperation to some former haunt on the Continent.",8802,9137
33,TOUCH,warmth,"“You don’t know him—don’t pronounce an opinion upon him,” I said, with warmth.",9408,9488
33,TOUCH,texture,"And the pocket-book was again deliberately produced, opened, sought through; from one of its compartments was extracted a shabby slip of paper, hastily torn off: I recognised in its texture and its stains of ultra-marine, and lake, and vermillion, the ravished margin of the portrait-cover.",9809,10099
33,TOUCH,hold,"He got up, held it close to my eyes: and I read, traced in Indian ink, in my own handwriting, the words “JANE EYRE”—the work doubtless of some moment of abstraction.",10100,10267
33,TOUCH,feel,"It was a grand boon doubtless; and independence would be glorious—yes, I felt that—_that_ thought swelled my heart.",12451,12568
33,TOUCH,feel,I again felt rather like an individual of but average gastronomical powers sitting down to feast alone at a table spread with provisions for a hundred.,13426,13577
33,TOUCH,cold,"And I am a hard woman,—impossible to put off “And then,” he pursued, “I am cold: no fervour infects me.”",15150,15257
33,TOUCH,feel,"“That is saying too much: such hazardous affirmations are a proof of the excitement under which you labour.” “It is not saying too much: I know what I feel, and how averse are my inclinations to the bare thought of marriage.",24458,24683
33,TOUCH,feel,"I feel I can easily and naturally make room in my heart for you, as my third and youngest sister.”",25424,25524
33,TOUCH,feel,"My task was a very hard one; but, as I was absolutely resolved—as my cousins saw at length that my mind was really and immutably fixed on making a just division of the property—as they must in their own hearts have felt the equity of the intention; and must, besides, have been innately conscious that in my place they would have done precisely what I wished to do—they yielded at length so far as to consent to put the affair to arbitration.",26010,26452
34,TOUCH,sensation,"Good fortune opens the hand as well as the heart wonderfully; and to give somewhat when we have largely received, is but to afford a vent to the unusual ebullition of the sensations.",183,365
34,TOUCH,feel,"I had long felt with pleasure that many of my rustic scholars liked me, and when we parted, that consciousness was confirmed: they manifested their affection plainly and strongly.",366,546
34,TOUCH,rub,"Moor House from chamber to cellar; my next to rub it up with bees-wax, oil, and an indefinite number of cloths, till it glitters again; my third, to arrange every chair, table, bed, carpet, with mathematical precision; afterwards I shall go near to ruin you in coals and peat to keep up good fires in every room; and lastly, the two days preceding that on which your sisters are expected will be devoted by Hannah and me to such a beating of eggs, sorting of currants, grating of spices, compounding of Christmas cakes, chopping up of materials for mince-pies, and solemnising of other culinary rites, as words can convey but an inadequate notion of to the uninitiated like you.",3030,3708
34,TOUCH,feel,"I feel I have adequate cause to be happy, and I _will_ be happy.",5530,5594
34,TOUCH,brush,"Happy at Moor House I was, and hard I worked; and so did Hannah: she was charmed to see how jovial I could be amidst the bustle of a house turned topsy-turvy—how I could brush, and dust, and clean, and cook.",5606,5814
34,TOUCH,feel,St. John was a good man; but I began to feel he had spoken truth of himself when he said he was hard and cold.,8868,8978
34,TOUCH,cold,St. John was a good man; but I began to feel he had spoken truth of himself when he said he was hard and cold.,8868,8978
34,TOUCH,cold,"I saw he was of the material from which nature hews her heroes—Christian and Pagan—her lawgivers, her statesmen, her conquerors: a steadfast bulwark for great interests to rest upon; but, at the fireside, too often a cold cumbrous column, gloomy and out of place.",9797,10062
34,TOUCH,contact,"In a minute I had my face under their bonnets, in contact first with Mary’s soft cheek, then with Diana’s flowing curls.",10980,11100
34,TOUCH,pat,"They laughed—kissed me—then Hannah: patted Carlo, who was half wild with delight; asked eagerly if all was well; and being assured in the affirmative, hastened into the house.",11101,11278
34,TOUCH,chill,"They were stiff with their long and jolting drive from Whitcross, and chilled with the frosty night air; but their pleasant countenances expanded to the cheerful firelight.",11278,11450
34,TOUCH,feel,"I had the pleasure of feeling that my arrangements met their wishes exactly, and that what I had done added a vivid charm to their joyous return home.",12175,12327
34,TOUCH,feel,And then it is such a bitter night—the keenest wind you ever felt.,13322,13388
34,TOUCH,feel,"He had performed an act of duty; made an exertion; felt his own strength to do and deny, and was on better terms with himself.",13706,13834
34,TOUCH,feel,"He had not kept his promise of treating me like his sisters; he continually made little chilling differences between us, which did not at all tend to the development of cordiality: in short, now that I was acknowledged his kinswoman, and lived under the same roof with him, I felt the distance between us to be far greater than when he had known me only as the village schoolmistress.",16325,16709
34,TOUCH,feel,"Such being the case, I felt not a little surprised when he raised his head suddenly from the desk over which he was stooping, and said— “You see, Jane, the battle is fought and the victory won.”",16830,17027
34,TOUCH,cold,"One afternoon, however, I got leave to stay at home, because I really had a cold.",19373,19454
