chapter,sense,lemma,sentence,sentence_start_char,sentence_end_char
10,TOUCH,feel,"I imagined myself only to be regretting my loss, and thinking how to repair it; but when my reflections were concluded, and I looked up and found that the afternoon was gone, and evening far advanced, another discovery dawned on me, namely, that in the interval I had undergone a transforming process; that my mind had put off all it had borrowed of Miss Temple—or rather that she had taken with her the serene atmosphere I had been breathing in her vicinity—and that now I was left in my natural element, and beginning to feel the stirring of old emotions.",3982,4539
10,TOUCH,sensation,"My world had for some years been in Lowood: my experience had been of its rules and systems; now I remembered that the real world was wide, and that a varied field of hopes and fears, of sensations and excitements, awaited those who had courage to go forth into its expanse, to seek real knowledge of life amidst its perils.",4724,5050
10,TOUCH,feel,And now I felt that it was not enough; I tired of the routine of eight years in one afternoon.,6175,6269
10,TOUCH,feel,It worked and worked faster: I felt the pulses throb in my head and temples; but for nearly an hour it worked in chaos; and no result came of its efforts.,8701,8855
10,TOUCH,shiver,"Feverish with vain labour, I got up and took a turn in the room; undrew the curtain, noted a star or two, shivered with cold, and again crept to bed.",8856,9007
10,TOUCH,cold,"Feverish with vain labour, I got up and took a turn in the room; undrew the curtain, noted a star or two, shivered with cold, and again crept to bed.",8856,9007
10,TOUCH,feel,"This scheme I went over twice, thrice; it was then digested in my mind; I had it in a clear practical form: I felt satisfied, and fell asleep.",9678,9822
10,TOUCH,hold,"“She is qualified to teach the usual branches of a good English education, together with French, Drawing, and Music” (in those days, reader, this now narrow catalogue of accomplishments, would have been held tolerably comprehensive).",10252,10485
10,TOUCH,hold,"At last, having held a document before her glasses for nearly five minutes, she presented it across the counter, accompanying the act by another inquisitive and mistrustful glance—it was for J.E. “Is there only one?”",12028,12245
10,TOUCH,feel,I now felt that an elderly lady was no bad ingredient in the business I had on hand.,13997,14081
10,TOUCH,brush,"Millcote, ——shire; I brushed up my recollections of the map of England; yes, I saw it; both the shire and the town.",14379,14494
10,TOUCH,brush,"I had brushed my black stuff travelling-dress, prepared my bonnet, gloves, and muff; sought in all my drawers to see that no article was left behind; and now having nothing more to do, I sat down and tried to rest.",17041,17255
10,TOUCH,embrace,In another second I was embracing and kissing her rapturously: “Bessie! Bessie!,18285,18364
10,TOUCH,feel,"I smiled at Bessie’s frank answer: I felt that it was correct, but I confess I was not quite indifferent to its import: at eighteen most people wish to please, and the conviction that they have not an exterior likely to second that desire brings anything but gratification.",20985,21260
11,TOUCH,chill,"All this is visible to you by the light of an oil lamp hanging from the ceiling, and by that of an excellent fire, near which I sit in my cloak and bonnet; my muff and umbrella lie on the table, and I am warming away the numbness and chill contracted by sixteen hours’ exposure to the rawness of an October day: I left Lowton at four o’clock A.M., and the Millcote town clock is now just striking eight.",443,848
11,TOUCH,sensation,"It is a very strange sensation to inexperienced youth to feel itself quite alone in the world, cut adrift from every connection, uncertain whether the port to which it is bound can be reached, and prevented by many impediments from returning to that it has quitted.",1512,1777
11,TOUCH,feel,"It is a very strange sensation to inexperienced youth to feel itself quite alone in the world, cut adrift from every connection, uncertain whether the port to which it is bound can be reached, and prevented by many impediments from returning to that it has quitted.",1512,1777
11,TOUCH,sensation,"The charm of adventure sweetens that sensation, the glow of pride warms it; but then the throb of fear disturbs it; and fear with me became predominant when half-an-hour elapsed and still I was alone.",1778,1978
11,TOUCH,feel,"We were now, as far as I could see, on a sort of common; but there were houses scattered all over the district; I felt we were in a different region to Lowood, more populous, less picturesque; more stirring, less romantic.",4114,4338
11,TOUCH,cold,"I am afraid you have had a tedious ride; John drives so slowly; you must be cold, come to the fire.”",6227,6329
11,TOUCH,cold,"“Oh, it is no trouble; I dare say your own hands are almost numbed with cold.",6553,6630
11,TOUCH,feel,"I felt rather confused at being the object of more attention than I had ever before received, and, that too, shown by my employer and superior; but as she did not herself seem to consider she was doing anything out of her place, I thought it better to take her civilities quietly.",7443,7725
11,TOUCH,feel,"To be sure it is pleasant at any time; for Thornfield is a fine old hall, rather neglected of late years perhaps, but still it is a respectable place; yet you know in winter-time one feels dreary quite alone in the best quarters.",8524,8753
11,TOUCH,feel,"I’m sure last winter (it was a very severe one, if you recollect, and when it did not snow, it rained and blew), not a creature but the butcher and postman came to the house, from November till February; and I really got quite melancholy with sitting night after night alone; I had Leah in to read to me sometimes; but I don’t think the poor girl liked the task much: she felt it confining.",9012,9402
11,TOUCH,stroke,"“But I’ll not keep you sitting up late to-night,” said she; “it is on the stroke of twelve now, and you have been travelling all day: you must feel tired.",9869,10023
11,TOUCH,feel,"“But I’ll not keep you sitting up late to-night,” said she; “it is on the stroke of twelve now, and you have been travelling all day: you must feel tired.",9869,10023
11,TOUCH,feel,"I thanked her for her considerate choice, and as I really felt fatigued with my long journey, expressed my readiness to retire.",10354,10481
11,TOUCH,chill,"A very chill and vault-like air pervaded the stairs and gallery, suggesting cheerless ideas of space and solitude; and I was glad, when finally ushered into my chamber, to find it of small dimensions, and furnished in ordinary, modern style.",10858,11101
11,TOUCH,cold,"When Mrs. Fairfax had bidden me a kind good-night, and I had fastened my door, gazed leisurely round, and in some measure effaced the eerie impression made by that wide hall, that dark and spacious staircase, and that long, cold gallery, by the livelier aspect of my little room, I remembered that, after a day of bodily fatigue and mental anxiety, I was now at last in safe haven.",11101,11482
11,TOUCH,feel,"I sometimes regretted that I was not handsomer; I sometimes wished to have rosy cheeks, a straight nose, and small cherry mouth; I desired to be tall, stately, and finely developed in figure; I felt it a misfortune that I was so little, so pale, and had features so irregular and so marked.",12976,13266
11,TOUCH,brush,"However, when I had brushed my hair very smooth, and put on my black frock—which, Quakerlike as it was, at least had the merit of fitting to a nicety—and adjusted my clean white tucker, I thought I should do respectably enough to appear before Mrs. Fairfax, and that my new pupil would not at least recoil from me with antipathy.",13449,13778
11,TOUCH,rub,"Traversing the long and matted gallery, I descended the slippery steps of oak; then I gained the hall: I halted there a minute; I looked at some pictures on the walls (one, I remember, represented a grim man in a cuirass, and one a lady with powdered hair and a pearl necklace), at a bronze lamp pendent from the ceiling, at a great clock whose case was of oak curiously carved, and ebon black with time and rubbing.",13902,14319
11,TOUCH,embrace,"Farther off were hills: not so lofty as those round Lowood, nor so craggy, nor so like barriers of separation from the living world; but yet quiet and lonely hills enough, and seeming to embrace Thornfield with a seclusion I had not expected to find existent so near the stirring locality of Millcote.",15224,15525
11,TOUCH,feel,"I did not like her the worse for that; on the contrary, I felt better pleased than ever.",17847,17935
11,TOUCH,feel,"I felt it would be injudicious to confine her too much at first; so, when I had talked to her a great deal, and got her to learn a little, and when the morning had advanced to noon, I allowed her to return to her nurse.",25139,25358
11,TOUCH,feel,"I have just opened the window, to let in a little air and sunshine; for everything gets so damp in apartments that are seldom inhabited; the drawing-room yonder feels like a vault.”",26102,26285
11,TOUCH,feel,"“In what order you keep these rooms, Mrs. Fairfax!” said I. “No dust, no canvas coverings: except that the air feels chilly, one would think they were inhabited daily.”",27029,27199
11,TOUCH,feel,"“In what way is he peculiar?” “I don’t know—it is not easy to describe—nothing striking, but you feel it when he speaks to you; you cannot be always sure whether he is in jest or earnest, whether he is pleased or the contrary; you don’t thoroughly understand him, in short—at least, I don’t: but it is of no consequence, he is a very good master.”",28436,28786
12,TOUCH,feel,"I felt a conscientious solicitude for Adèle’s welfare and progress, and a quiet liking for her little self: just as I cherished towards Mrs. Fairfax a thankfulness for her kindness, and a pleasure in her society proportionate to the tranquil regard she had for me, and the moderation of her mind and character.",1477,1789
12,TOUCH,feel,"Women are supposed to be very calm generally: but women feel just as men feel; they need exercise for their faculties, and a field for their efforts, as much as their brothers do; they suffer from too rigid a restraint, too absolute a stagnation, precisely as men would suffer; and it is narrow-minded in their more privileged fellow-creatures to say that they ought to confine themselves to making puddings and knitting stockings, to playing on the piano and embroidering bags.",3892,4370
12,TOUCH,feel,"Women are supposed to be very calm generally: but women feel just as men feel; they need exercise for their faculties, and a field for their efforts, as much as their brothers do; they suffer from too rigid a restraint, too absolute a stagnation, precisely as men would suffer; and it is narrow-minded in their more privileged fellow-creatures to say that they ought to confine themselves to making puddings and knitting stockings, to playing on the piano and embroidering bags.",3892,4370
12,TOUCH,cold,"One afternoon in January, Mrs. Fairfax had begged a holiday for Adèle, because she had a cold; and, as Adèle seconded the request with an ardour that reminded me how precious occasional holidays had been to me in my own childhood, I accorded it,",5859,6105
12,TOUCH,cold,"It was a fine, calm day, though very cold; I was tired of sitting still in the library through a whole long morning:",6165,6281
12,TOUCH,feel,"Gathering my mantle about me, and sheltering my hands in my muff, I did not feel the cold, though it froze keenly; as was attested by a sheet of ice covering the causeway, where a little brooklet, now congealed, had overflowed after a rapid thaw some days since.",8036,8298
12,TOUCH,cold,"Gathering my mantle about me, and sheltering my hands in my muff, I did not feel the cold, though it froze keenly; as was attested by a sheet of ice covering the causeway, where a little brooklet, now congealed, had overflowed after a rapid thaw some days since.",8036,8298
12,TOUCH,feel,"My ear, too, felt the flow of currents; in what dales and depths I could not tell: but there were many hills beyond Hay, and doubtless many becks threading their passes.",8878,9047
12,TOUCH,feel,"The traveller now, stooping, felt his foot and leg, as if trying whether they were sound; apparently something ailed them, for he halted to the stile",12586,12735
12,TOUCH,clasp,"His figure was enveloped in a riding cloak, fur collared and steel clasped; its details were not apparent, but I traced the general points of middle height and considerable breadth of chest.",13226,13417
12,TOUCH,feel,"I felt no fear of him, and but little shyness.",13627,13673
12,TOUCH,feel,"If even this stranger had smiled and been good-humoured to me when I addressed him; if he had put off my offer of assistance gaily and with thanks, I should have gone on my way and not felt any vocation to renew inquiries: but the frown, the roughness of the traveller, set me at my ease: I retained my station when he waved to me to go, and announced— “I cannot think of leaving you, sir, at so late an hour, in this solitary lane, till I see you are fit to mount your horse.”",14267,14747
12,TOUCH,roughness,"If even this stranger had smiled and been good-humoured to me when I addressed him; if he had put off my offer of assistance gaily and with thanks, I should have gone on my way and not felt any vocation to renew inquiries: but the frown, the roughness of the traveller, set me at my ease: I retained my station when he waved to me to go, and announced— “I cannot think of leaving you, sir, at so late an hour, in this solitary lane, till I see you are fit to mount your horse.”",14267,14747
12,TOUCH,hold,"“Yes, sir.” “You have not an umbrella that I can use as a stick?” “No.” “Try to get hold of my horse’s bridle and lead him to me: you are not afraid?” I should have been afraid to touch a horse when alone, but when told to do it, I was disposed to obey.",16251,16508
12,TOUCH,touch,"“Yes, sir.” “You have not an umbrella that I can use as a stick?” “No.” “Try to get hold of my horse’s bridle and lead him to me: you are not afraid?” I should have been afraid to touch a horse when alone, but when told to do it, I was disposed to obey.",16251,16508
12,TOUCH,touch,"A touch of a spurred heel made his horse first start and rear, and then bound away; the dog rushed in his traces; all three vanished, “Like heath that, in the wilderness, The wild wind whirls away.”",17608,17814
12,TOUCH,tremble,"I lingered at the gates; I lingered on the lawn; I paced backwards and forwards on the pavement; the shutters of the glass door were closed; I could not see into the interior; and both my eyes and spirit seemed drawn from the gloomy house—from the grey hollow filled with rayless cells, as it appeared to me—to that sky expanded before me,—a blue sea absolved from taint of cloud; the moon ascending it in solemn march; her orb seeming to look up as she left the hill-tops, from behind which she had come, far and farther below her, and aspired to the zenith, midnight dark in its fathomless depth and measureless distance; and for those trembling stars that followed her course; they made my heart tremble, my veins glow when I viewed them.",20178,20919
12,TOUCH,tremble,"I lingered at the gates; I lingered on the lawn; I paced backwards and forwards on the pavement; the shutters of the glass door were closed; I could not see into the interior; and both my eyes and spirit seemed drawn from the gloomy house—from the grey hollow filled with rayless cells, as it appeared to me—to that sky expanded before me,—a blue sea absolved from taint of cloud; the moon ascending it in solemn march; her orb seeming to look up as she left the hill-tops, from behind which she had come, far and farther below her, and aspired to the zenith, midnight dark in its fathomless depth and measureless distance; and for those trembling stars that followed her course; they made my heart tremble, my veins glow when I viewed them.",20178,20919
12,TOUCH,grate,"This ruddy shine issued from the great dining-room, whose two-leaved door stood open, and showed a genial fire in the grate, glancing on marble hearth and brass fire-irons, and revealing purple draperies and polished furniture, in the most pleasant radiance.",21212,21470
12,TOUCH,caress,"I caressed him, and he wagged his great tail; but he looked an eerie creature to be alone with, and I could not tell whence he had come.",22064,22200
13,TOUCH,feel,"Besides, the eccentricity of the proceeding was piquant: I felt interested to see how he would go on.",5895,5998
13,TOUCH,pressure,"Kindly, as usual—and, as usual, rather trite—she condoled with him on the pressure of business he had had all day; on the annoyance it must have been to him with that painful sprain: then she commended his patience and perseverance in going through with it.",6163,6422
13,TOUCH,hold,"One gleam of light lifted into relief a half-submerged mast, on which sat a cormorant, dark and large, with wings flecked with foam; its beak held a gold bracelet set with gems, that I had touched with as brilliant tints as my palette could yield, and as glittering distinctness as my pencil could impart.",15566,15871
13,TOUCH,touch,"One gleam of light lifted into relief a half-submerged mast, on which sat a cormorant, dark and large, with wings flecked with foam; its beak held a gold bracelet set with gems, that I had touched with as brilliant tints as my palette could yield, and as glittering distinctness as my pencil could impart.",15566,15871
13,TOUCH,touch,On the neck lay a pale reflection like moonlight; the same faint lustre touched the train of thin clouds from which rose and bowed this vision of the Evening Star.,16579,16744
13,TOUCH,feel,“And you felt self-satisfied with the result of your ardent labours?” “Far from it.,18223,18307
13,TOUCH,caress,"Adèle went to kiss him before quitting the room: he endured the caress, but scarcely seemed to relish it more than Pilot would have done, nor so much.",19280,19432
14,TOUCH,brush,"I brushed Adèle’s hair and made her neat, and having ascertained that I was myself in my usual Quaker trim, where there was nothing to retouch—all being too close and plain, braided locks included, to admit of disarrangement—we descended, Adèle wondering whether the _petit coffre_ was at length come; for, owing to some mistake, its arrival had hitherto been delayed.",1328,1696
14,TOUCH,softness,"He was, in short, in his after-dinner mood; more expanded and genial, and also more self-indulgent than the frigid and rigid temper of the morning; still he looked preciously grim, cushioning his massive head against the swelling back of his chair, and receiving the light of the fire on his granite-hewn features, and in his great, dark eyes; for he had great, dark eyes, and very fine eyes, too—not without a certain change in their depths sometimes, which, if it was not softness, reminded you, at least, of that feeling.",5402,5928
14,TOUCH,stroke,"And so, under pretence of softening the previous outrage, of stroking and soothing me into placidity, you stick a sly penknife under my ear!",7183,7323
14,TOUCH,pat,"Another stick of the penknife, when she pretended to pat my head: and that is because I said I did not like the society of children and old women (low be it spoken!).",8023,8189
14,TOUCH,feel,"He had deigned an explanation, almost an apology, and I did not feel insensible to his condescension, and would not seem so.",12149,12275
14,TOUCH,feel,"Know, that in the course of your future life you will often find yourself elected the involuntary confidant of your acquaintances’ secrets: people will instinctively find out, as I have done, that it is not your forte to tell of yourself, but to listen while others talk of themselves; they will feel, too, that you listen with no malevolent scorn of their indiscretion, but with a kind of innate sympathy; not the less comforting and encouraging because it is very unobtrusive in its manifestations.”",17464,17967
14,TOUCH,feel,I feel sure it will work you more misery if you listen to it.”,20403,20467
14,TOUCH,embrace,"He said this as if he spoke to a vision, viewless to any eye but his own; then, folding his arms, which he had half extended, on his chest, he seemed to enclose in their embrace the invisible being.",20640,20840
14,TOUCH,feel,"it be right then,” I said, as I rose, deeming it useless to continue a discourse which was all darkness to me; and, besides, sensible that the character of my interlocutor was beyond my penetration; at least, beyond its present reach; and feeling the uncertainty, the vague sense of insecurity, which accompanies a conviction of ignorance.",22961,23302
14,TOUCH,feel,"“In that sense I do feel apprehensive—I have no wish to talk nonsense.” “If you did, it would be in such a grave, quiet manner, I should mistake it for sense.",23575,23734
15,TOUCH,feel,"“You never felt jealousy, did you, Miss Eyre?",3401,3446
15,TOUCH,feel,Of course not: I need not ask you; because you never felt love.,3447,3510
15,TOUCH,grip,"Some hated thought seemed to have him in its grip, and to hold him so tightly that he could not advance.",4698,4804
15,TOUCH,hold,"Some hated thought seemed to have him in its grip, and to hold him so tightly that he could not advance.",4698,4804
15,TOUCH,hold,"Pain, shame, ire, impatience, disgust, detestation, seemed momentarily to hold a quivering conflict in the large pupil dilating under his ebon eyebrow.",4977,5128
15,TOUCH,chill,"I never seemed in his way; he did not take fits of chilling hauteur: when he met me unexpectedly, the encounter seemed welcome; he had always a word and sometimes a smile for me: when summoned by formal invitation to his presence, I was honoured by a cordiality of reception that made me feel I really possessed the power to amuse him, and that these evening conferences were sought as much for his pleasure as for my benefit.",13851,14279
15,TOUCH,feel,"I never seemed in his way; he did not take fits of chilling hauteur: when he met me unexpectedly, the encounter seemed welcome; he had always a word and sometimes a smile for me: when summoned by formal invitation to his presence, I was honoured by a cordiality of reception that made me feel I really possessed the power to amuse him, and that these evening conferences were sought as much for his pleasure as for my benefit.",13851,14279
15,TOUCH,feel,I felt at times as if he were my relation rather than my master:,15040,15105
15,TOUCH,touch,Just then it seemed my chamber-door was touched; as if fingers had swept the panels in groping a way along the dark gallery outside.,17840,17972
15,TOUCH,chill,I was chilled with fear.,18015,18041
15,TOUCH,feel,"Silence composes the nerves; and as an unbroken hush now reigned again through the whole house, I began to feel the return of slumber.",18313,18447
15,TOUCH,hold,"He took it from my hand, held it up, and surveyed the bed, all blackened and scorched, the sheets drenched, the carpet round swimming in water.",21858,22003
15,TOUCH,cold,"I grew weary: it was cold, in spite of the cloak; and then I did not see the use of staying, as I was not to rouse the house.",23469,23595
15,TOUCH,hold,"He held out his hand; I gave him mine: he took it first in one, then in both his own.",25514,25601
15,TOUCH,feel,"Nothing else that has being would have been tolerable to me in the character of creditor for such an obligation: but you: it is different;—I feel your benefits no burden, Jane.”",25695,25874
15,TOUCH,tremble,"He paused; gazed at me: words almost visible trembled on his lips,—but his voice was checked.",25874,25969
15,TOUCH,cold,"you _will_ go?” “I am cold, sir.”",26602,26638
16,TOUCH,cold,"“It is to be hoped he will not take cold with sleeping on the library sofa,” &c.",941,1023
16,TOUCH,rub,"Leah stood up in the window-seat, rubbing the panes of glass dimmed with smoke.",1276,1355
16,TOUCH,warmth,"“I was not dreaming,” I said, with some warmth, for her brazen coolness provoked me.",4171,4255
16,TOUCH,feel,"Yet,” suggested the secret voice which talks to us in our own hearts, “_you_ are not beautiful either, and perhaps Mr. Rochester approves you: at any rate, you have often felt as if he did; and last night—remember his words; remember his look; remember his voice!”",8866,9132
16,TOUCH,feel,I never felt better.”,12045,12068
17,TOUCH,feel,"When I heard this, I was beginning to feel a strange chill and failing at the heart.",357,441
17,TOUCH,chill,"When I heard this, I was beginning to feel a strange chill and failing at the heart.",357,441
17,TOUCH,sensation,"I was actually permitting myself to experience a sickening sense of disappointment; but rallying my wits, and recollecting my principles, I at once called my sensations to order; and it was wonderful how I got over the temporary blunder—how I cleared up the mistake of supposing Mr. Rochester’s movements a matter in which I had any cause to take a vital interest.",442,806
17,TOUCH,hold,"“Well, I sometimes think we are too quiet; but we run a chance of being busy enough now: for a little while at least,” said Mrs. Fairfax, still holding the note before her spectacles.",2417,2602
17,TOUCH,press,"From school duties she was exonerated: Mrs. Fairfax had pressed me into her service, and I was all day in the storeroom, helping (or hindering) her and the cook; learning to make custards and cheese-cakes and French pastry, to truss game and garnish desert-dishes.",4427,4693
