chapter,sense,lemma,sentence,sentence_start_char,sentence_end_char
17,TOUCH,grate,"This was when I chanced to see the third-storey staircase door (which of late had always been kept locked) open slowly, and give passage to the form of Grace Poole, in prim cap, white apron, and handkerchief; when I watched her glide along the gallery, her quiet tread muffled in a list slipper; when I saw her look into the bustling, topsy-turvy bedrooms,—just say a word, perhaps, to the charwoman about the proper way to polish a grate, or clean a marble mantelpiece, or take stains from papered walls, and then pass on.",5074,5597
17,TOUCH,nudge,"“I wonder whether the master—” The charwoman was going on; but here Leah turned and perceived me, and she instantly gave her companion a nudge.",7266,7412
17,TOUCH,rub,"Thursday came: all work had been completed the previous evening; carpets were laid down, bed-hangings festooned, radiant white counterpanes spread, toilet tables arranged, furniture rubbed, flowers piled in vases: both chambers and saloons looked as fresh and bright as hands could make them.",7681,7973
17,TOUCH,feel,"“Don’t you feel hungry, Adèle?” “Mais oui, mademoiselle: voilà cinq ou six heures que nous n’avons pas mangé.”",11741,11854
17,TOUCH,cold,"Threading this chaos, I at last reached the larder; there I took possession of a cold chicken, a roll of bread, some tarts, a plate or two and a knife and fork: with this booty I made a hasty retreat.",12505,12705
17,TOUCH,hold,"I found Adèle peeping through the schoolroom door, which she held ajar.",13631,13703
17,TOUCH,touch,ere long she touched my knee.,20320,20351
17,TOUCH,hold,"I try to concentrate my attention on those netting-needles, on the meshes of the purse I am forming—I wish to think only of the work I have in my hands, to see only the silver beads and silk threads that lie in my lap; whereas, I distinctly behold his figure, and I inevitably recall the moment when I last saw it; just after I had rendered him, what he deemed, an essential service, and he, holding my hand, and looking down on my face, surveyed me with eyes that revealed a heart full and eager to overflow; in whose emotions I had a part.",28612,29153
17,TOUCH,feel,"I looked, and had an acute pleasure in looking,—a precious yet poignant pleasure; pure gold, with a steely point of agony: a pleasure like what the thirst-perishing man might feel who knows the well to which he has crept is poisoned, yet stoops and drinks divine draughts nevertheless.",29784,30071
17,TOUCH,feel,"I believe he is of mine;—I am sure he is—I feel akin to him—I understand the language of his countenance and movements: though rank and wealth sever us widely, I have something in my brain and heart, in my blood and nerves, that assimilates me mentally to him.",31842,32102
17,TOUCH,touch,"“Pardon me, madam: no need of explanation; your own fine sense must inform you that one of your frowns would be a sufficient substitute for capital punishment.” “Sing!” said she, and again touching the piano, she commenced an accompaniment in spirited style.",42639,42900
17,TOUCH,sensation,"Mrs. Fairfax had said Mr. Rochester possessed a fine voice: he did—a mellow, powerful bass, into which he threw his own feeling, his own force; finding a way through the ear to the heart, and there waking sensation strangely.",42995,43220
17,TOUCH,cold,“Did you take any cold that night you half drowned me?” “Not the least.”,44248,44323
18,TOUCH,clasp,"He looked at me: I happened to be near him, as I had been fastening the clasp of Mrs. Dent’s bracelet, which had got loose.",2100,2225
18,TOUCH,hold,"Within the arch, the bulky figure of Sir George Lynn, whom Mr. Rochester had likewise chosen, was seen enveloped in a white sheet: before him, on a table, lay open a large book; and at his side stood Amy Eshton, draped in Mr. Rochester’s cloak, and holding a book in her hand.",2792,3068
18,TOUCH,touch,"What charade Colonel Dent and his party played, what word they chose, how they acquitted themselves, I no longer remember; but I still see the consultation which followed each scene: I see Mr. Rochester turn to Miss Ingram, and Miss Ingram to him; I see her incline her head towards him, till the jetty curls almost touch his shoulder and wave against his cheek; I hear their mutual whisperings; I recall their interchanged glances; and something even of the feeling roused by the spectacle returns in memory at this moment.",8363,8889
18,TOUCH,touch,"I have told you, reader, that I had learnt to love Mr. Rochester: I could not unlove him now, merely because I found that he had ceased to notice me—because I might pass hours in his presence, and he would never once turn his eyes in my direction—because I saw all his attentions appropriated by a great lady, who scorned to touch me with the hem of her robes as she passed; who, if ever her dark and imperious eye fell on me by chance, would withdraw it instantly as from an object too mean to merit observation.",8889,9402
18,TOUCH,feel,"I could not unlove him, because I felt sure he would soon marry this very lady—because I read daily in her a proud security in his intentions respecting her—because I witnessed hourly in him a style of courtship which, if careless and choosing rather to be sought than to seek, was yet, in its very carelessness, captivating, and in its very pride, irresistible.",9403,9767
18,TOUCH,sensation,She advocated a high tone of sentiment; but she did not know the sensations of sympathy and pity; tenderness and truth were not in her.,10630,10765
18,TOUCH,feel,"I saw he was going to marry her, for family, perhaps political reasons, because her rank and connections suited him; I felt he had not given her his love, and that her qualifications were ill adapted to win from him that treasure.",11481,11711
18,TOUCH,touch,This was the point—this was where the nerve was touched and teased—this was where the fever was sustained and fed: _,11712,11828
18,TOUCH,softness,"Arrows that continually glanced off from Mr. Rochester’s breast and fell harmless at his feet, might, I knew, if shot by a surer hand, have quivered keen in his proud heart—have called love into his stern eye, and softness into his sardonic face; or, better still, without weapons a silent conquest might have been won.",12972,13293
18,TOUCH,feel,"It surprised me when I first discovered that such was his intention: I had thought him a man unlikely to be influenced by motives so commonplace in his choice of a wife; but the longer I considered the position, education, &c., of the parties, the less I felt justified in judging and blaming either him or Miss Ingram for acting in conformity to ideas and principles instilled into them, doubtless, from their childhood.",14483,14904
18,TOUCH,hold,"All their class held these principles: I supposed, then, they had reasons for holding them such as I could not fathom.",14905,15023
18,TOUCH,hold,"All their class held these principles: I supposed, then, they had reasons for holding them such as I could not fathom.",14905,15023
18,TOUCH,feel,"It seemed to me that, were I a gentleman like him, I would take to my bosom only such a wife as I could love; but the very obviousness of the advantages to the husband’s own happiness offered by this plan convinced me that there must be arguments against its general adoption of which I was quite ignorant: otherwise I felt sure all the world would act as I wished to act.",15024,15398
18,TOUCH,feel,"The sarcasm that had repelled, the harshness that had startled me once, were only like keen condiments in a choice dish: their presence was pungent, but their absence would be felt as comparatively insipid.",15741,15947
18,TOUCH,feel,"And as for the vague something—was it a sinister or a sorrowful, a designing or a desponding expression?—that opened upon a careful observer, now and then, in his eye, and closed again before one could fathom the strange depth partially disclosed; that something which used to make me fear and shrink, as if I had been wandering amongst volcanic-looking hills, and had suddenly felt the ground quiver and seen it gape: that something, I, at intervals, beheld still; and with throbbing heart, but not with palsied nerves.",15948,16468
18,TOUCH,hold,"The Ladies Lynn and Ingram continued to consort in solemn conferences, where they nodded their two turbans at each other, and held up their four hands in confronting gestures of surprise, or mystery, or horror, according to the theme on which their gossip ran, like a pair of magnified puppets.",16918,17212
18,TOUCH,feel,"The want of his animating influence appeared to be peculiarly felt one day that he had been summoned to Millcote on business, and was not likely to return till late.",18028,18193
18,TOUCH,firmness,"For a handsome and not an unamiable-looking man, he repelled me exceedingly: there was no power in that smooth-skinned face of a full oval shape: no firmness in that aquiline nose and small cherry mouth; there was no thought on the low, even forehead; no command in that blank, brown eye.",21769,22059
18,TOUCH,cold,"As I sat in my usual nook, and looked at him with the light of the girandoles on the mantelpiece beaming full over him—for he occupied an arm-chair drawn close to the fire, and kept shrinking still nearer, as if he were cold, I compared him with Mr. Rochester.",22059,22319
18,TOUCH,shiver,"Mr. Mason, shivering as some one chanced to open the door, asked for more coal to be put on the fire, which had burnt out its flame, though its mass of cinder still shone hot and red.",24547,24730
18,TOUCH,hold,"pause—reflect!” was her mama’s cry; but she swept past her in stately silence, passed through the door which Colonel Dent held open, and we heard her enter the library.",28663,28833
18,TOUCH,feel,"Miss Mary declared she felt, for her part, she never dared venture.",28942,29009
18,TOUCH,feel,How do you feel?,29576,29592
18,TOUCH,press,"“Now, now, good people,” returned Miss Ingram, “don’t press upon me.",29653,29722
18,TOUCH,press,"Pressed for further explanation, they declared she had told them of things they had said and done when they were mere children; described books and ornaments they had in their boudoirs at home: keepsakes that different relations had presented to them.",31715,31966
19,TOUCH,cold,"I stood on the rug and warmed my hands, which were rather cold with sitting at a distance from the drawing-room fire.",615,732
19,TOUCH,feel,I felt now as composed as ever I did in my life: there was nothing indeed in the gipsy’s appearance to trouble one’s calm.,733,855
19,TOUCH,tremble,Why don’t you tremble?” “I’m not cold.”,1720,1762
19,TOUCH,cold,Why don’t you tremble?” “I’m not cold.”,1720,1762
19,TOUCH,cold,"Having indulged a while in this sedative, she raised her bent body, took the pipe from her lips, and while gazing steadily at the fire, said very deliberately— “You are cold; you are sick; and you are silly.”",1992,2203
19,TOUCH,cold,"You are cold, because you are alone: no contact strikes the fire from you that is in you.",2251,2340
19,TOUCH,contact,"You are cold, because you are alone: no contact strikes the fire from you that is in you.",2251,2340
19,TOUCH,hold,"I gave her a shilling: she put it into an old stocking-foot which she took out of her pocket, and having tied it round and returned it, she told me to hold out my hand.",3495,3663
19,TOUCH,touch,"She approached her face to the palm, and pored over it without touching it.",3671,3748
19,TOUCH,feel,"“I wonder what thoughts are busy in your heart during all the hours you sit in yonder room with the fine people flitting before you like shapes in a magic-lantern: just as little sympathetic communion passing between you and them as if they were really mere shadows of human forms, and not the actual substance.” “I feel tired often, sleepy sometimes, but seldom sad.” “Then you have some secret hope to buoy you up and please you with whispers of the future?” “Not I.",4482,4953
19,TOUCH,hold,"The forehead declares, ‘Reason sits firm and holds the reins, and she will not let the feelings burst away and hurry her to wild chasms.",12063,12199
19,TOUCH,grip,As I spoke he gave my wrist a convulsive grip; the smile on his lips froze: apparently a spasm caught his breath.,16743,16858
19,TOUCH,feel,"“Do you feel ill, sir?”",17159,17182
19,TOUCH,hold,"Holding my hand in both his own, he chafed it; gazing on me, at the same time, with the most troubled and dreary look.",17425,17545
20,TOUCH,cold,"Mesdames” (to the dowagers), “you will take cold to a dead certainty, if you stay in this chill gallery any longer.”",3721,3839
20,TOUCH,chill,"Mesdames” (to the dowagers), “you will take cold to a dead certainty, if you stay in this chill gallery any longer.”",3721,3839
20,TOUCH,cold,"Not liking to sit in the cold and darkness, I thought I would lie down on my bed, dressed as I was.",5025,5124
20,TOUCH,tap,"I left the window, and moved with little noise across the carpet; as I stooped to take off my shoes, a cautious hand tapped low at the door.",5125,5267
20,TOUCH,hold,Mr. Rochester stood in the gallery holding a light.,5437,5490
20,TOUCH,hold,"He still waited; he held a key in his hand: approaching one of the small, black doors, he put it in the lock; he paused, and addressed me again.",6038,6184
20,TOUCH,feel,"I felt a thrill while I answered him; but no coldness, and no faintness.",6283,6357
20,TOUCH,hold,"Mr. Rochester held the candle over him; I recognised in his pale and seemingly lifeless face—the stranger, Mason: I saw too that his linen on one side, and one arm, was almost soaked in blood.",7587,7781
20,TOUCH,hold,"“Hold the candle,” said Mr. Rochester, and I took it: he fetched a basin of water from the washstand: “Hold that,” said he.",7781,7904
20,TOUCH,hold,"“Hold the candle,” said Mr. Rochester, and I took it: he fetched a basin of water from the washstand: “Hold that,” said he.",7781,7904
20,TOUCH,feel,"“Sir?” “I shall have to leave you in this room with this gentleman, for an hour, or perhaps two hours: you will sponge the blood as I do when it returns: if he feels faint, you will put the glass of water on that stand to his lips, and your salts to his nose.",8458,8718
20,TOUCH,grate,"I experienced a strange feeling as the key grated in the lock, and the sound of his retreating step ceased to be heard.",9227,9348
20,TOUCH,hold,"Lastly, I saw Mr. Mason was submissive to Mr. Rochester; that the impetuous will of the latter held complete sway over the inertness of the former: the few words which had passed between them assured me of this.",12282,12493
20,TOUCH,tremble,I could not forget how the arm had trembled which he rested on my shoulder: and it was no light matter which could thus bow the resolute spirit and thrill the vigorous frame of Fairfax Rochester.,13025,13222
20,TOUCH,hold,"I had, again and again, held the water to Mason’s white lips; again and again offered him the stimulating salts: my efforts seemed ineffectual: either bodily or mental suffering, or loss of blood, or all three combined, were fast prostrating his strength.",13398,13653
20,TOUCH,handle,"Then he approached Mason, whom the surgeon was already handling.",14801,14867
20,TOUCH,cold,"You can’t travel a mile without that, I know, in this damned cold climate.",18135,18209
20,TOUCH,hold,"He held out the tiny glass, and I half filled it from the water-bottle on the washstand.",19111,19201
20,TOUCH,feel,"Be of good cheer, Richard; step out—that’s it!” “I do feel better,” remarked Mr. Mason.",19837,19927
20,TOUCH,feel,"“Come where there is some freshness, for a few moments,” he said; “that house is a mere dungeon: don’t you feel it so?” “It seems to me a splendid mansion, sir.”",22257,22421
20,TOUCH,feel,"I answered him by assuming it: to refuse would, I felt, have been unwise.",26680,26755
20,TOUCH,feel,"Still you are miserable; for hope has quitted you on the very confines of life: your sun at noon darkens in an eclipse, which you feel will not leave it till the time of setting.",27921,28099
20,TOUCH,feel,"Such society revives, regenerates: you feel better days come back—higher wishes, purer feelings; you desire to recommence your life, and to spend what remains to you of days in a way more worthy of an immortal being.",28659,28875
20,TOUCH,softness,"“Little friend,” said he, in quite a changed tone—while his face changed too, losing all its softness and gravity, and becoming harsh and sarcastic—“you have noticed my tender penchant for Miss Ingram:",30540,30742
20,TOUCH,cold,What cold fingers!,31120,31138
20,TOUCH,touch,They were warmer last night when I touched them at the door of the mysterious chamber.,31139,31225
21,TOUCH,hold,"On repairing thither, I found a man waiting for me, having the appearance of a gentleman’s servant: he was dressed in deep mourning, and the hat he held in his hand was surrounded with a crape band.",2049,2249
21,TOUCH,stroke,The information about Mr. John’s death and the manner of it came too suddenly: it brought on a stroke.,4281,4384
21,TOUCH,grate,"It was very clean and neat: the ornamental windows were hung with little white curtains; the floor was spotless; the grate and fire-irons were burnished bright, and the fire burnt clear.",13414,13600
21,TOUCH,tap,"Old times crowded fast back on me as I watched her bustling about—setting out the tea-tray with her best china, cutting bread and butter, toasting a tea-cake, and, between whiles, giving little Robert or Jane an occasional tap or push, just as she used to give me in former days.",14775,15054
21,TOUCH,feel,"I still felt as a wanderer on the face of the earth; but I experienced firmer trust in myself and my own powers, and less withering dread of oppression.",16611,16763
21,TOUCH,feel,"This I felt sure was Eliza, though I could trace little resemblance to her former self in that elongated and colourless visage.",17913,18042
21,TOUCH,feel,"A sneer, however, whether covert or open, had now no longer that power over me it once possessed: as I sat between my cousins, I was surprised to find how easy I felt under the total neglect of the one and the semi-sarcastic attentions of the other—Eliza did not mortify, nor Georgiana ruffle me.",19702,19998
21,TOUCH,clasp,"I had left this woman in bitterness and hate, and I came back to her now with no other emotion than a sort of ruth for her great sufferings, and a strong yearning to forget and forgive all injuries—to be reconciled and clasp hands in amity.",23023,23265
21,TOUCH,press,"My fingers had fastened on her hand which lay outside the sheet: had she pressed mine kindly, I should at that moment have experienced true pleasure.",23822,23971
21,TOUCH,feel,"Again she regarded me so icily, I felt at once that her opinion of me—her feeling towards me—was unchanged and unchangeable.",24184,24308
21,TOUCH,feel,"I felt pain, and then I felt ire; and then I felt a determination to subdue her—to be her mistress in spite both of her nature and her will.",24527,24668
21,TOUCH,feel,"I felt pain, and then I felt ire; and then I felt a determination to subdue her—to be her mistress in spite both of her nature and her will.",24527,24668
21,TOUCH,feel,"I felt pain, and then I felt ire; and then I felt a determination to subdue her—to be her mistress in spite both of her nature and her will.",24527,24668
21,TOUCH,hold,said she; “don’t annoy me with holding the clothes fast.,25459,25515
21,TOUCH,feel,John is sunk and degraded—his look is frightful—I feel ashamed for him when I see him.”,27822,27911
21,TOUCH,cold,"They were very cold, indeed, at first.",28949,28987
21,TOUCH,touch,"but not quite the thing,” I thought, as I surveyed the effect: “they want more force and spirit;” and I wrought the shades blacker, that the lights might flash more brilliantly—a happy touch or two secured success.",30826,31040
21,TOUCH,cold,"Georgiana took out her handkerchief and blew her nose for an hour afterwards; Eliza sat cold, impassable, and assiduously industrious.",38584,38720
21,TOUCH,feel,Feeling without judgment is a washy draught indeed; but judgment untempered by feeling is too bitter and husky a morsel for human deglutition.,38892,39036
21,TOUCH,feel,Feeling without judgment is a washy draught indeed; but judgment untempered by feeling is too bitter and husky a morsel for human deglutition.,38892,39036
21,TOUCH,grate,"I found the sick-room unwatched, as I had expected: no nurse was there; the patient lay still, and seemingly lethargic; her livid face sunk in the pillows: the fire was dying in the grate.",39804,39992
21,TOUCH,sensation,"She made an effort to alter her position, but failed: her face changed; she seemed to experience some inward sensation—the precursor, perhaps, of the last pang.",42517,42679
21,TOUCH,sensation,I could not forget my own sensations when you thus started up and poured out the venom of your mind: I felt fear as if an animal that I had struck or pushed had looked up at me with human eyes and cursed me in a man’s voice.—Bring me some water!,43852,44097
21,TOUCH,feel,I could not forget my own sensations when you thus started up and poured out the venom of your mind: I felt fear as if an animal that I had struck or pushed had looked up at me with human eyes and cursed me in a man’s voice.—Bring me some water!,43852,44097
21,TOUCH,feel,"“If you could but be persuaded to think no more of it, aunt, and to regard me with kindness and forgiveness——” “You have a very bad disposition,” said she, “and one to this day I feel it impossible to understand: how for nine years you could be patient and quiescent under any treatment, and in the tenth break out all fire and violence, I can never comprehend.”",45008,45373
21,TOUCH,touch,I approached my cheek to her lips: she would not touch it.,45615,45673
21,TOUCH,cold,As I laid her down—for I raised her and supported her on my arm while she drank—I covered her ice-cold and clammy hand with mine: the feeble fingers shrank from my touch—the glazing eyes shunned my gaze.,45750,45955
21,TOUCH,touch,As I laid her down—for I raised her and supported her on my arm while she drank—I covered her ice-cold and clammy hand with mine: the feeble fingers shrank from my touch—the glazing eyes shunned my gaze.,45750,45955
21,TOUCH,cold,"There was stretched Sarah Reed’s once robust and active frame, rigid and still: her eye of flint was covered with its cold lid; her brow and strong traits wore yet the impress of her inexorable soul.",46762,46962
22,TOUCH,hold,"Her plans required all her time and attention, she said; she was about to depart for some unknown bourne; and all day long she stayed in her own room, her door bolted within, filling trunks, emptying drawers, burning papers, and holding no communication with any one.",1423,1690
22,TOUCH,embrace,"I shall devote myself for a time to the examination of the Roman Catholic dogmas, and to a careful study of the workings of their system: if I find it to be, as I half suspect it is, the one best calculated to ensure the doing of all things decently and in order, I shall embrace the tenets of Rome and probably take the veil.”",2228,2557
22,TOUCH,feel,"How people feel when they are returning home from an absence, long or short, I did not know: I had never experienced the sensation.",3479,3610
22,TOUCH,sensation,"How people feel when they are returning home from an absence, long or short, I did not know: I had never experienced the sensation.",3479,3610
22,TOUCH,cold,"I had known what it was to come back to Gateshead when a child after a long walk, to be scolded for looking cold or gloomy; and later, what it was to come back from church to Lowood, to long for a plenteous meal and a good fire, and to be unable to get either.",3611,3871
22,TOUCH,chill,"The west, too, was warm: no watery gleam chilled it—it seemed as if there was a fire lit, an altar burning behind its screen of marbled vapour, and out of apertures shone a golden redness.",6649,6839
22,TOUCH,feel,"I felt glad as the road shortened before me: so glad that I stopped once to ask myself what that joy meant: and to remind reason that it was not to my home I was going, or to a permanent resting-place, or to a place where fond friends looked out for me and waited my arrival.",6839,7115
22,TOUCH,tremble,"I did not think I should tremble in this way when I saw him, or lose my voice or the power of motion in his presence.",8494,8611
22,TOUCH,feel,"I suppose I do come on; though in what fashion I know not; being scarcely cognisant of my movements, and solicitous only to appear calm; and, above all, to control the working muscles of my face—which I feel rebel insolently against my will, and struggle to express what I had resolved to conceal.",8892,9189
22,TOUCH,touch,"If I dared, I’d touch you, to see if you are substance or shadow, you elf!—but I’d as soon offer to take hold of a blue _ignis fatuus_ light in a marsh.",9855,10007
22,TOUCH,hold,"If I dared, I’d touch you, to see if you are substance or shadow, you elf!—but I’d as soon offer to take hold of a blue _ignis fatuus_ light in a marsh.",9855,10007
22,TOUCH,feel,He seemed to think it too good for common purposes: it was the real sunshine of feeling—he shed it over me now.,11874,11987
22,TOUCH,hold,An impulse held me fast—a force turned me round.,12286,12334
22,TOUCH,feel,"This was very pleasant; there is no happiness like that of being loved by your fellow-creatures, and feeling that your presence is an addition to their comfort.",12794,12956
